{"$schema":"https://json-schema.org/draft/2020-12/schema","$id":"urn:hwm:schema:project-state:v2","title":"HWM deterministic project state v2","type":"object","additionalProperties":false,"$defs":{"error":{"type":"object","additionalProperties":false,"required":["code","message","retryable"],"properties":{"code":{"type":"string","pattern":"^[A-Z][A-Z0-9_]{1,63}$"},"message":{"type":"string","minLength":1,"maxLength":2000},"retryable":{"type":"boolean"}}},"provenance":{"type":"object","additionalProperties":false,"required":["kind","repo","sha"],"properties":{"kind":{"type":"string","enum":["git_ref","github_actions_run","evidence_manifest","baseline"]},"repo":{"type":"string","pattern":"^[A-Za-z0-9_.-]+/[A-Za-z0-9_.-]+$"},"sha":{"type":"string","pattern":"^[0-9a-f]{40}$"},"reference":{"type":"string","minLength":1,"maxLength":1000}}},"checkpoint":{"type":"object","additionalProperties":false,"required":["status"],"properties":{"status":{"type":"string","enum":["known","unknown","error"]},"sha":{"type":"string","pattern":"^[0-9a-f]{40}$"},"provenance":{"type":"array","minItems":1,"items":{"$ref":"#/$defs/provenance"}},"reason":{"type":"string","minLength":1,"maxLength":2000},"error":{"$ref":"#/$defs/error"}},"oneOf":[{"properties":{"status":{"const":"known"}},"required":["sha","provenance"],"not":{"anyOf":[{"required":["reason"]},{"required":["error"]}]}},{"properties":{"status":{"const":"unknown"}},"required":["reason"],"not":{"anyOf":[{"required":["sha"]},{"required":["provenance"]},{"required":["error"]}]}},{"properties":{"status":{"const":"error"}},"required":["error"],"not":{"anyOf":[{"required":["sha"]},{"required":["provenance"]},{"required":["reason"]}]}}]},"health":{"type":"object","additionalProperties":false,"required":["status"],"properties":{"status":{"type":"string","enum":["healthy","unhealthy","unknown","error"]},"source_sha":{"type":"string","pattern":"^[0-9a-f]{40}$"},"reason":{"type":"string","minLength":1,"maxLength":2000},"error":{"$ref":"#/$defs/error"},"unresolved_conflicts":{"type":"integer","minimum":0}},"oneOf":[{"properties":{"status":{"enum":["healthy","unhealthy"]}},"required":["source_sha"],"not":{"anyOf":[{"required":["reason"]},{"required":["error"]}]}},{"properties":{"status":{"const":"unknown"}},"required":["reason"],"not":{"anyOf":[{"required":["source_sha"]},{"required":["error"]}]}},{"properties":{"status":{"const":"error"}},"required":["error"],"not":{"anyOf":[{"required":["source_sha"]},{"required":["reason"]}]}}]},"product_head":{"type":"object","additionalProperties":false,"required":["status"],"properties":{"status":{"type":"string","enum":["known","unknown","error"]},"sha":{"type":"string","pattern":"^[0-9a-f]{40}$"},"provenance":{"type":"array","minItems":1,"items":{"$ref":"#/$defs/provenance"}},"reason":{"type":"string","minLength":1,"maxLength":2000,"pattern":"^(?=.*\\S)[^\\r\\n]*$"},"error":{"$ref":"#/$defs/error"}},"oneOf":[{"properties":{"status":{"const":"known"}},"required":["sha","provenance"],"not":{"anyOf":[{"required":["reason"]},{"required":["error"]}]}},{"properties":{"status":{"const":"unknown"}},"required":["reason"],"not":{"anyOf":[{"required":["sha"]},{"required":["provenance"]},{"required":["error"]}]}},{"properties":{"status":{"const":"error"}},"required":["error"],"not":{"anyOf":[{"required":["sha"]},{"required":["provenance"]},{"required":["reason"]}]}}]}},"required":["schema","generated_at","provenance","product","requirements","tasks","knowledge","graph"],"properties":{"schema":{"const":"hwm-project-state/v2"},"generated_at":{"type":"string","format":"date-time","pattern":"^\\d{4}-\\d{2}-\\d{2}T\\d{2}:\\d{2}:\\d{2}(?:\\.\\d+)?Z$"},"provenance":{"type":"array","minItems":1,"items":{"$ref":"#/$defs/provenance"}},"product":{"type":"object","additionalProperties":false,"required":["repo","head","last_core_green","last_full_green","last_post_merge_green","last_live_evidenced"],"properties":{"repo":{"type":"string","pattern":"^[A-Za-z0-9_.-]+/[A-Za-z0-9_.-]+$"},"head":{"$ref":"#/$defs/product_head"},"last_core_green":{"$ref":"#/$defs/checkpoint"},"last_full_green":{"$ref":"#/$defs/checkpoint"},"last_post_merge_green":{"$ref":"#/$defs/checkpoint"},"last_live_evidenced":{"$ref":"#/$defs/checkpoint"}}},"requirements":{"type":"object","patternProperties":{"^[A-Z][A-Z0-9_-]{0,63}$":{"type":"object","additionalProperties":false,"required":["status","missing_gates"],"properties":{"status":{"type":"string","enum":["complete","partial","blocked","unknown"]},"missing_gates":{"type":"array","items":{"type":"string","minLength":1},"uniqueItems":true}}}},"additionalProperties":false},"tasks":{"type":"object","additionalProperties":false,"required":["ready","claimed","blocked"],"properties":{"ready":{"type":"array","items":{"type":"integer","minimum":1},"uniqueItems":true},"claimed":{"type":"array","items":{"type":"integer","minimum":1},"uniqueItems":true},"blocked":{"type":"array","items":{"type":"integer","minimum":1},"uniqueItems":true}}},"knowledge":{"$ref":"#/$defs/health"},"graph":{"$ref":"#/$defs/health"}}}
