{"generated_at":"2026-08-16T19:27:45Z","graph":{"reason":"No authoritative I03 graph-health input is available.","status":"unknown"},"knowledge":{"reason":"No authoritative I03 knowledge-health input is available.","status":"unknown"},"product":{"head":{"provenance":[{"kind":"git_ref","reference":"refs/heads/main","repo":"Dsamofalov/hwm_predictor","sha":"8fd669336b36064e842252d69fb4016cc526a9d4"}],"sha":"8fd669336b36064e842252d69fb4016cc526a9d4","status":"known"},"last_core_green":{"provenance":[{"kind":"github_actions_run","reference":"workflow=.github/workflows/ci.yml;run=31727700552;suite=86074732000;gate=HWM / Core;check_run=94546993956;status_id=52198023145","repo":"Dsamofalov/hwm_predictor","sha":"8fd669336b36064e842252d69fb4016cc526a9d4"}],"sha":"8fd669336b36064e842252d69fb4016cc526a9d4","status":"known"},"last_full_green":{"provenance":[{"kind":"github_actions_run","reference":"workflow=.github/workflows/ci.yml;run=31727700552;suite=86074732000;gate=HWM / Full;check_run=94546273227;status_id=52197856764","repo":"Dsamofalov/hwm_predictor","sha":"8fd669336b36064e842252d69fb4016cc526a9d4"}],"sha":"8fd669336b36064e842252d69fb4016cc526a9d4","status":"known"},"last_live_evidenced":{"reason":"No authoritative I03 live-evidence checkpoint input is available.","status":"unknown"},"last_post_merge_green":{"reason":"No authoritative I03 post-merge checkpoint input is available.","status":"unknown"},"repo":"Dsamofalov/hwm_predictor"},"provenance":[{"kind":"git_ref","reference":"refs/heads/main","repo":"Dsamofalov/hwm-control","sha":"3acce6d4353f1922bcdbc7c9f43d7d0176ddd6e3"},{"kind":"git_ref","reference":"refs/heads/main","repo":"Dsamofalov/hwm_predictor","sha":"8fd669336b36064e842252d69fb4016cc526a9d4"},{"kind":"github_actions_run","reference":"workflow=.github/workflows/ci.yml;run=31727700552;suite=86074732000;gate=HWM / Core;check_run=94546993956;status_id=52198023145","repo":"Dsamofalov/hwm_predictor","sha":"8fd669336b36064e842252d69fb4016cc526a9d4"},{"kind":"github_actions_run","reference":"workflow=.github/workflows/ci.yml;run=31727700552;suite=86074732000;gate=HWM / Full;check_run=94546273227;status_id=52197856764","repo":"Dsamofalov/hwm_predictor","sha":"8fd669336b36064e842252d69fb4016cc526a9d4"}],"requirements":{},"schema":"hwm-project-state/v2","tasks":{"blocked":[49,50],"claimed":[48],"ready":[]}}
